{
  "schema_version": "3.0.0",
  "case_id": "C9e40b42879a375cd",
  "domain": "MGMT",
  "passage_function": "research_opportunity",
  "group": "contrast",
  "control_origin": "derived_contrast",
  "split": "holdout",
  "applicable_categories": {
    "fidelity": "optional",
    "managerial_framing": "optional",
    "scholarly_positioning": "required",
    "evidence_discipline": "required",
    "prose_clarity": "required"
  },
  "gold_fidelity_facts": [
    "a project portfolio committee",
    "selects projects and review milestones",
    "build a valuable portfolio while limiting irreversible exposure",
    "the committee cannot use later milestone evidence in the initial selection"
  ],
  "acceptable_interpretations": [
    "Equivalent concise wording is acceptable.",
    "Explicit rubric labels are unnecessary."
  ],
  "prohibited_model_changes": [
    "Do not add unavailable future facts.",
    "Do not replace the stated objective."
  ],
  "evidence_boundaries": [
    "Synthetic case only.",
    "No field outcome is supplied."
  ],
  "expected_strengths": [
    "Concrete decision structure.",
    "Bounded claim."
  ],
  "expected_weaknesses": [
    "Incomplete mechanism and scope."
  ],
  "case_specific_anchors": {
    "high": "Faithful and functionally complete.",
    "medium": "Competent but incomplete.",
    "low": "Material defect or generic framing."
  },
  "expert_quality_level": "low",
  "expert_review_status": "pending",
  "contrast": {
    "original_case_id": "Cd525a2c38c33e6c5",
    "changed_construct": "verbosity",
    "expected_declines": {
      "prose_clarity": 2
    },
    "expected_stable": {
      "fidelity": 1,
      "evidence_discipline": 1
    },
    "expected_hard_failure": null,
    "minimum_total_reduction": 2,
    "acceptable_alternatives": [
      "A stricter deduction is acceptable when specifically justified."
    ]
  }
}
