{
  "schema_version": "3.0.0",
  "case_id": "C96c0e4eec48f1793",
  "domain": "OR",
  "passage_function": "model_setting",
  "group": "intermediate",
  "control_origin": "synthetic_analogue",
  "split": "validation",
  "applicable_categories": {
    "fidelity": "required",
    "managerial_framing": "required",
    "scholarly_positioning": "not_applicable",
    "evidence_discipline": "required",
    "prose_clarity": "required"
  },
  "gold_fidelity_facts": [
    "a capacity planner",
    "chooses first-stage capacity and a recourse policy",
    "minimize capacity, recourse, and unmet-demand cost",
    "recourse actions occur only after demand is observed and must respect installed capacity"
  ],
  "acceptable_interpretations": [
    "Equivalent concise wording is acceptable.",
    "Explicit rubric labels are unnecessary."
  ],
  "prohibited_model_changes": [
    "Do not add unavailable future facts.",
    "Do not replace the stated objective."
  ],
  "evidence_boundaries": [
    "Synthetic case only.",
    "No field outcome is supplied."
  ],
  "expected_strengths": [
    "Concrete decision structure.",
    "Bounded claim."
  ],
  "expected_weaknesses": [
    "Incomplete mechanism and scope."
  ],
  "case_specific_anchors": {
    "high": "Faithful and functionally complete.",
    "medium": "Competent but incomplete.",
    "low": "Material defect or generic framing."
  },
  "expert_quality_level": "medium",
  "expert_review_status": "pending",
  "contrast": null
}
