{
  "schema_version": "3.0.0",
  "case_id": "C85d31395ac3f3a9c",
  "domain": "OR",
  "passage_function": "managerial_implications",
  "group": "intermediate",
  "control_origin": "synthetic_analogue",
  "split": "holdout",
  "applicable_categories": {
    "fidelity": "required",
    "managerial_framing": "required",
    "scholarly_positioning": "not_applicable",
    "evidence_discipline": "required",
    "prose_clarity": "required"
  },
  "gold_fidelity_facts": [
    "a production scheduler",
    "chooses between an exact solver incumbent and a heuristic schedule",
    "minimize tardiness and setup cost",
    "only solutions available before release can affect operations"
  ],
  "acceptable_interpretations": [
    "Equivalent concise wording is acceptable.",
    "Explicit rubric labels are unnecessary."
  ],
  "prohibited_model_changes": [
    "Do not add unavailable future facts.",
    "Do not replace the stated objective."
  ],
  "evidence_boundaries": [
    "Synthetic case only.",
    "No field outcome is supplied."
  ],
  "expected_strengths": [
    "Concrete decision structure.",
    "Bounded claim."
  ],
  "expected_weaknesses": [
    "Incomplete mechanism and scope."
  ],
  "case_specific_anchors": {
    "high": "Faithful and functionally complete.",
    "medium": "Competent but incomplete.",
    "low": "Material defect or generic framing."
  },
  "expert_quality_level": "medium",
  "expert_review_status": "pending",
  "contrast": null
}
