{
  "schema_version": "3.0.0",
  "case_id": "C91741f5a15968eab",
  "domain": "IS",
  "passage_function": "research_opportunity",
  "group": "contrast",
  "control_origin": "derived_contrast",
  "split": "validation",
  "applicable_categories": {
    "fidelity": "required",
    "managerial_framing": "optional",
    "scholarly_positioning": "required",
    "evidence_discipline": "required",
    "prose_clarity": "required"
  },
  "gold_fidelity_facts": [
    "a moderation policy owner",
    "sets a review threshold using privacy-permitted signals",
    "minimize expected moderation harm and review cost",
    "privacy-restricted attributes are unavailable unless consent and policy permit their use"
  ],
  "acceptable_interpretations": [
    "Equivalent concise wording is acceptable.",
    "Explicit rubric labels are unnecessary."
  ],
  "prohibited_model_changes": [
    "Do not add unavailable future facts.",
    "Do not replace the stated objective."
  ],
  "evidence_boundaries": [
    "Synthetic case only.",
    "No field outcome is supplied."
  ],
  "expected_strengths": [
    "Concrete decision structure.",
    "Bounded claim."
  ],
  "expected_weaknesses": [
    "Incomplete mechanism and scope."
  ],
  "case_specific_anchors": {
    "high": "Faithful and functionally complete.",
    "medium": "Competent but incomplete.",
    "low": "Material defect or generic framing."
  },
  "expert_quality_level": "low",
  "expert_review_status": "pending",
  "contrast": {
    "original_case_id": "C6522bb769a3df89a",
    "changed_construct": "unsupported_hype",
    "expected_declines": {
      "evidence_discipline": 4
    },
    "expected_stable": {
      "fidelity": 1
    },
    "expected_hard_failure": null,
    "minimum_total_reduction": 4,
    "acceptable_alternatives": [
      "A stricter deduction is acceptable when specifically justified."
    ]
  }
}
