{
  "schema_version": "3.0.0",
  "case_id": "C1976c893e1876cb8",
  "domain": "IS",
  "passage_function": "managerial_implications",
  "group": "contrast",
  "control_origin": "derived_contrast",
  "split": "holdout",
  "applicable_categories": {
    "fidelity": "required",
    "managerial_framing": "required",
    "scholarly_positioning": "not_applicable",
    "evidence_discipline": "required",
    "prose_clarity": "required"
  },
  "gold_fidelity_facts": [
    "a ranking-system owner",
    "selects a ranking rule subject to an exposure constraint",
    "maximize expected relevance subject to the stated exposure constraint",
    "the system cannot use attributes that are unavailable or prohibited at ranking time"
  ],
  "acceptable_interpretations": [
    "Equivalent concise wording is acceptable.",
    "Explicit rubric labels are unnecessary."
  ],
  "prohibited_model_changes": [
    "Do not add unavailable future facts.",
    "Do not replace the stated objective."
  ],
  "evidence_boundaries": [
    "Synthetic case only.",
    "No field outcome is supplied."
  ],
  "expected_strengths": [
    "Concrete decision structure.",
    "Bounded claim."
  ],
  "expected_weaknesses": [
    "Incomplete mechanism and scope."
  ],
  "case_specific_anchors": {
    "high": "Faithful and functionally complete.",
    "medium": "Competent but incomplete.",
    "low": "Material defect or generic framing."
  },
  "expert_quality_level": "low",
  "expert_review_status": "pending",
  "contrast": {
    "original_case_id": "Cdb839c5dd28bd2ee",
    "changed_construct": "boundaries",
    "expected_declines": {
      "evidence_discipline": 3
    },
    "expected_stable": {
      "fidelity": 1,
      "prose_clarity": 1
    },
    "expected_hard_failure": null,
    "minimum_total_reduction": 3,
    "acceptable_alternatives": [
      "A stricter deduction is acceptable when specifically justified."
    ]
  }
}
