{
  "schema_version": "3.0.0",
  "case_id": "C436328cc96f629fa",
  "domain": "IS",
  "passage_function": "research_opportunity",
  "group": "negative",
  "control_origin": "original_negative",
  "split": "validation",
  "applicable_categories": {
    "fidelity": "required",
    "managerial_framing": "optional",
    "scholarly_positioning": "required",
    "evidence_discipline": "required",
    "prose_clarity": "required"
  },
  "gold_fidelity_facts": [
    "a moderation policy owner",
    "sets a review threshold using privacy-permitted signals",
    "minimize expected moderation harm and review cost",
    "privacy-restricted attributes are unavailable unless consent and policy permit their use"
  ],
  "acceptable_interpretations": [
    "Equivalent concise wording is acceptable.",
    "Explicit rubric labels are unnecessary."
  ],
  "prohibited_model_changes": [
    "Do not add unavailable future facts.",
    "Do not replace the stated objective."
  ],
  "evidence_boundaries": [
    "Synthetic case only.",
    "No field outcome is supplied."
  ],
  "expected_strengths": [
    "Concrete decision structure.",
    "Bounded claim."
  ],
  "expected_weaknesses": [
    "Incomplete mechanism and scope."
  ],
  "case_specific_anchors": {
    "high": "Faithful and functionally complete.",
    "medium": "Competent but incomplete.",
    "low": "Material defect or generic framing."
  },
  "expert_quality_level": "low",
  "expert_review_status": "pending",
  "contrast": null
}
