{
  "schema_version": "3.0.0",
  "case_id": "Cc170de9460a43cb3",
  "domain": "OM",
  "passage_function": "business_problem",
  "group": "positive",
  "control_origin": "synthetic_analogue",
  "split": "development",
  "applicable_categories": {
    "fidelity": "required",
    "managerial_framing": "required",
    "scholarly_positioning": "optional",
    "evidence_discipline": "required",
    "prose_clarity": "required"
  },
  "gold_fidelity_facts": [
    "a regional inventory planner",
    "allocates a fixed stock across service zones",
    "minimize expected shortage and leftover cost",
    "stock cannot be transferred after orders arrive"
  ],
  "acceptable_interpretations": [
    "Equivalent concise wording is acceptable.",
    "Explicit rubric labels are unnecessary."
  ],
  "prohibited_model_changes": [
    "Do not add unavailable future facts.",
    "Do not replace the stated objective."
  ],
  "evidence_boundaries": [
    "Synthetic case only.",
    "No field outcome is supplied."
  ],
  "expected_strengths": [
    "Concrete decision structure.",
    "Bounded claim."
  ],
  "expected_weaknesses": [],
  "case_specific_anchors": {
    "high": "Faithful and functionally complete.",
    "medium": "Competent but incomplete.",
    "low": "Material defect or generic framing."
  },
  "expert_quality_level": "high",
  "expert_review_status": "pending",
  "contrast": null
}
